{
    "object": "meeting",
    "action": "state",
    "id": "wY29dWimwUQa0EWerQ7bNsRddlYtHBgJiEL8ZHnzjv8=",
    "name": "Meeting",
    "creation": 1633098331,
    "last_modified": 1633098340,
    "location": "EPFL",
    "start": 1633098900,
    "end": 1633102500,
    "modification_id": "wY29dWimwUQa0EWerQ7bNsRddlYtHBgJiEL8ZHnzjv8=",
    "modification_signatures": [
        {
            "witness": "M5ZychEi5rwm22FjwjNuljL1qMJWD2sE7oX9fcHNMDU=",
            "signature": "XXX"
        }
    ]
}
